{
  "$schema": "./schemas/source-snapshot-manifest.schema.json",
  "description": "Planned and executed source-to-target snapshot copies for the AtomicMemory public monorepo migration. One entry per source-to-target copy. Each entry points to a per-source allowlist under docs/migration/allowlists/. Source commits are recorded at the time the snapshot is planned; initial_monorepo_commit is filled in after the copy lands. Do not preserve git history from source repos. See docs/migration/release-history.md for the provenance contract.",
  "target_repo": "atomicstrata/atomicmemory",
  "copy_method_default": "clean source snapshot, no git history",
  "manifest_recorded_on": "2026-05-17",
  "entries": [
    {
      "id": "core",
      "source_repo": "atomicstrata/atomicmemory-core",
      "source_ref": "main",
      "source_commit": "0133cc68cf015f13972ba70c0695839bc8678fa8",
      "package_name": "@atomicmemory/core",
      "package_pre_migration_version": "1.0.3",
      "target_path": "packages/core",
      "allowlist": "docs/migration/allowlists/core.json",
      "copy_method": "clean source snapshot, no git history",
      "initial_monorepo_commit": "fcd7c96",
      "status": "copied",
      "notes": "Phase 2 first-wave copy. Old repo retained for history lookup and archived per docs/migration/release-history.md."
    },
    {
      "id": "sdk",
      "source_repo": "atomicstrata/atomicmemory-sdk",
      "source_ref": "main",
      "source_commit": "d3abc7d83f456d493c0598e099b8a11590001153",
      "package_name": "@atomicmemory/sdk",
      "package_pre_migration_version": "1.0.1",
      "target_path": "packages/sdk",
      "allowlist": "docs/migration/allowlists/sdk.json",
      "copy_method": "clean source snapshot, no git history",
      "initial_monorepo_commit": "fcd7c96",
      "status": "copied",
      "notes": "Phase 2 first-wave copy. Every adapter depends on this package."
    },
    {
      "id": "cli",
      "source_repo": "atomicstrata/atomicmemory-integrations",
      "source_ref": "main",
      "source_commit": "287e9ba80f215a08588fd5da543bd15741c045dd",
      "source_subpath": "packages/cli",
      "package_name": "@atomicmemory/cli",
      "package_pre_migration_version": "0.1.1",
      "target_path": "packages/cli",
      "allowlist": "docs/migration/allowlists/cli.json",
      "copy_method": "clean source snapshot, no git history",
      "initial_monorepo_commit": "a133b27",
      "status": "copied",
      "notes": "Phase 2 first-wave copy from atomicmemory-integrations monorepo subdirectory."
    },
    {
      "id": "mcp-server",
      "source_repo": "atomicstrata/atomicmemory-integrations",
      "source_ref": "main",
      "source_commit": "287e9ba80f215a08588fd5da543bd15741c045dd",
      "source_subpath": "packages/mcp-server",
      "package_name": "@atomicmemory/mcp-server",
      "package_pre_migration_version": "0.1.1",
      "target_path": "packages/mcp-server",
      "allowlist": "docs/migration/allowlists/mcp-server.json",
      "copy_method": "clean source snapshot, no git history",
      "initial_monorepo_commit": "a133b27",
      "status": "copied",
      "notes": "Phase 2 first-wave copy from atomicmemory-integrations monorepo subdirectory."
    },
    {
      "id": "adapter-vercel-ai",
      "source_repo": "atomicstrata/atomicmemory-integrations",
      "source_ref": "main",
      "source_commit": "287e9ba80f215a08588fd5da543bd15741c045dd",
      "source_subpath": "adapters/vercel-ai-sdk",
      "package_name": "@atomicmemory/vercel-ai",
      "package_pre_migration_version": "0.1.0",
      "target_path": "adapters/vercel-ai",
      "allowlist": "docs/migration/allowlists/adapter-vercel-ai.json",
      "copy_method": "clean source snapshot, no git history",
      "initial_monorepo_commit": "a133b27",
      "status": "copied",
      "notes": "Directory rename normalizes adapter path to match unscoped package name. Update repository.directory in package.json to adapters/vercel-ai at copy time."
    },
    {
      "id": "adapter-openai-agents",
      "source_repo": "atomicstrata/atomicmemory-integrations",
      "source_ref": "main",
      "source_commit": "287e9ba80f215a08588fd5da543bd15741c045dd",
      "source_subpath": "adapters/openai-agents-sdk",
      "package_name": "@atomicmemory/openai-agents",
      "package_pre_migration_version": "0.1.0",
      "target_path": "adapters/openai-agents",
      "allowlist": "docs/migration/allowlists/adapter-openai-agents.json",
      "copy_method": "clean source snapshot, no git history",
      "initial_monorepo_commit": "a133b27",
      "status": "copied",
      "notes": "Directory rename normalizes adapter path to match unscoped package name. Update repository.directory in package.json to adapters/openai-agents at copy time."
    },
    {
      "id": "adapter-langchain",
      "source_repo": "atomicstrata/atomicmemory-integrations",
      "source_ref": "feat/integration-maturity-framework-adapters",
      "source_commit": "c6e3b5082af08ff71128478c252894cc9aa6f002",
      "source_subpath": "adapters/langchain-js",
      "package_name": "@atomicmemory/langchain",
      "package_pre_migration_version": "0.1.0",
      "target_path": "adapters/langchain",
      "allowlist": "docs/migration/allowlists/adapter-langchain.json",
      "copy_method": "clean source snapshot, no git history",
      "initial_monorepo_commit": "a133b27",
      "status": "copied",
      "notes": "Source lives on the framework-adapters branch and is not yet on integrations main. Directory rename normalizes adapter path to match unscoped package name. Update repository.directory in package.json to adapters/langchain at copy time."
    },
    {
      "id": "adapter-langgraph",
      "source_repo": "atomicstrata/atomicmemory-integrations",
      "source_ref": "feat/integration-maturity-framework-adapters",
      "source_commit": "c6e3b5082af08ff71128478c252894cc9aa6f002",
      "source_subpath": "adapters/langgraph-js",
      "package_name": "@atomicmemory/langgraph",
      "package_pre_migration_version": "0.1.0",
      "target_path": "adapters/langgraph",
      "allowlist": "docs/migration/allowlists/adapter-langgraph.json",
      "copy_method": "clean source snapshot, no git history",
      "initial_monorepo_commit": "a133b27",
      "status": "copied",
      "notes": "Source lives on the framework-adapters branch and is not yet on integrations main. Directory rename normalizes adapter path to match unscoped package name. Update repository.directory in package.json to adapters/langgraph at copy time."
    },
    {
      "id": "adapter-mastra",
      "source_repo": "atomicstrata/atomicmemory-integrations",
      "source_ref": "feat/integration-maturity-framework-adapters",
      "source_commit": "c6e3b5082af08ff71128478c252894cc9aa6f002",
      "source_subpath": "adapters/mastra",
      "package_name": "@atomicmemory/mastra",
      "package_pre_migration_version": "0.1.0",
      "target_path": "adapters/mastra",
      "allowlist": "docs/migration/allowlists/adapter-mastra.json",
      "copy_method": "clean source snapshot, no git history",
      "initial_monorepo_commit": "a133b27",
      "status": "copied",
      "notes": "Source lives on the framework-adapters branch and is not yet on integrations main. Source and target directory names already match."
    },
    {
      "id": "plugin-claude-code",
      "source_repo": "atomicstrata/atomicmemory-integrations",
      "source_ref": "main",
      "source_commit": "287e9ba80f215a08588fd5da543bd15741c045dd",
      "source_subpath": "plugins/claude-code",
      "package_name": "@atomicmemory/claude-code-plugin",
      "package_pre_migration_version": "0.1.14",
      "target_path": "plugins/claude-code",
      "allowlist": "docs/migration/allowlists/plugin-claude-code.json",
      "copy_method": "clean source snapshot, no git history",
      "initial_monorepo_commit": "a133b27",
      "status": "copied",
      "notes": "Lock-step plugin versioning preserved with sibling plugins. Marketplace manifest revalidation required before promoting the new monorepo metadata."
    },
    {
      "id": "plugin-openclaw",
      "source_repo": "atomicstrata/atomicmemory-integrations",
      "source_ref": "main",
      "source_commit": "287e9ba80f215a08588fd5da543bd15741c045dd",
      "source_subpath": "plugins/openclaw",
      "package_name": "@atomicmemory/openclaw-plugin",
      "package_pre_migration_version": "0.1.14",
      "target_path": "plugins/openclaw",
      "allowlist": "docs/migration/allowlists/plugin-openclaw.json",
      "copy_method": "clean source snapshot, no git history",
      "initial_monorepo_commit": "a133b27",
      "status": "copied",
      "notes": "Lock-step plugin versioning preserved with sibling plugins."
    },
    {
      "id": "plugin-hermes",
      "source_repo": "atomicstrata/atomicmemory-integrations",
      "source_ref": "main",
      "source_commit": "287e9ba80f215a08588fd5da543bd15741c045dd",
      "source_subpath": "plugins/hermes",
      "package_name": "@atomicmemory/hermes-plugin",
      "package_pre_migration_version": "0.1.14",
      "target_path": "plugins/hermes",
      "allowlist": "docs/migration/allowlists/plugin-hermes.json",
      "copy_method": "clean source snapshot, no git history",
      "initial_monorepo_commit": "a133b27",
      "status": "copied",
      "notes": "Plugin bundles the Hermes Python provider (pyproject.toml and Python source). The phase 2 Python decision concerns only the standalone @atomicmemory/python PyPI SDK and does not block this plugin migration."
    },
    {
      "id": "plugin-codex",
      "source_repo": "atomicstrata/atomicmemory-integrations",
      "source_ref": "main",
      "source_commit": "287e9ba80f215a08588fd5da543bd15741c045dd",
      "source_subpath": "plugins/codex",
      "package_name": "@atomicmemory/codex-plugin",
      "package_pre_migration_version": "0.1.14",
      "target_path": "plugins/codex",